{
  "$schema": "https://longlineage.local/schema/source_to_target_manifest-1.1.0.json",
  "schema_name": "longlineage.source_to_target_manifest",
  "schema_version": "1.1.0",
  "origin_repository": "InterSubMod",
  "origin_commit": "0ee2fa1b31fcf6af670efd301251b5b3a24c1a99",
  "license_review_status": "PENDING_PUBLIC_RELEASE_AUDIT",
  "mappings": [
    {
      "origin_id": "ism-bam-reader",
      "source_path": "InterSubMod/src/core/BamReader.cpp",
      "source_sha256": "d2da0ef68b907fe093d8722f739e0f77dee22bc4e12b88d6b37c30ccfe2876af",
      "target": "src/io/alignment.cpp",
      "target_kind": "FILE",
      "target_presence": "PRESENT",
      "target_digest_kind": "FILE_SHA256",
      "target_sha256": "92354a61e23a50d82d446a68dcdd57f452218dd700b79fc1c42c3c126e900250",
      "implementation_status": "SKELETON",
      "verification_status": "NOT_VERIFIED",
      "verified_evidence_id": null,
      "transformation": "clean_reimplementation_with_typed_coordinates_and_fail_closed_errors",
      "reuse": "concept_and_fixtures_only"
    },
    {
      "origin_id": "ism-read-parser",
      "source_path": "InterSubMod/src/core/ReadParser.cpp",
      "source_sha256": "34a38c96fb0184840321482a2f1ec64eee928f392db4d4b3bee5628a14bff03a",
      "target": "src/io/alignment.cpp",
      "target_kind": "FILE",
      "target_presence": "PRESENT",
      "target_digest_kind": "FILE_SHA256",
      "target_sha256": "92354a61e23a50d82d446a68dcdd57f452218dd700b79fc1c42c3c126e900250",
      "implementation_status": "SKELETON",
      "verification_status": "NOT_VERIFIED",
      "verified_evidence_id": null,
      "transformation": "clean_reimplementation_with_R_A_O_X",
      "reuse": "concept_and_fixtures_only"
    },
    {
      "origin_id": "ism-indexed-block-reader",
      "source_path": "InterSubMod/src/core/BamReader.cpp",
      "source_sha256": "d2da0ef68b907fe093d8722f739e0f77dee22bc4e12b88d6b37c30ccfe2876af",
      "target": "src/io/block_reader.cpp",
      "target_kind": "FILE",
      "target_presence": "PRESENT",
      "target_digest_kind": "FILE_SHA256",
      "target_sha256": "b448f183e1e221357ef6f5752b2b78a260e556c5938f256317f448634522f925",
      "implementation_status": "IMPLEMENTED",
      "verification_status": "CONTRACT_VERIFIED",
      "verified_evidence_id": "P2_BLOCK_READER_INDEXED",
      "transformation": "clean_reimplementation_with_frozen_order_block_planning_explicit_index_and_worker_owned_handles",
      "reuse": "concept_and_synthetic_fixtures_only"
    },
    {
      "origin_id": "ism-methylation-parser",
      "source_path": "InterSubMod/src/core/MethylationParser.cpp",
      "source_sha256": "45b51176cd28bda77adf82de1a80a0f618eba5d2cf518da97e0c651cadee1d01",
      "target": "src/io/mm_ml.cpp",
      "target_kind": "FILE",
      "target_presence": "PRESENT",
      "target_digest_kind": "FILE_SHA256",
      "target_sha256": "9a245023a3f576f56fe3e2edb3a8e030524bc800907142cc5e2c12bb774e274c",
      "implementation_status": "IMPLEMENTED",
      "verification_status": "CONTRACT_VERIFIED",
      "verified_evidence_id": "IO_MM_ML",
      "transformation": "clean_reimplementation_with_typed_B_array_and_ParseResult",
      "reuse": "concept_and_fixtures_only"
    },
    {
      "origin_id": "ism-somatic-snv",
      "source_path": "InterSubMod/src/core/SomaticSnv.cpp",
      "source_sha256": "9082c5e0845d6c2761bf3cebb7f0804567ccdec86bde2de20a8209ef8da0b8ed",
      "target": "src/io/hts_preflight.cpp",
      "target_kind": "FILE",
      "target_presence": "PRESENT",
      "target_digest_kind": "FILE_SHA256",
      "target_sha256": "41c5d752d117894bfa8ad5ad87cb7293a28be438170251c6d7223b0acdaf1935",
      "implementation_status": "SKELETON",
      "verification_status": "NOT_VERIFIED",
      "verified_evidence_id": null,
      "transformation": "clean_reimplementation_with_index_and_read_error_checks",
      "reuse": "concept_and_fixtures_only"
    },
    {
      "origin_id": "m1-frozen-analyzer",
      "source_path": "InterSubMod/research/20260715_all_ssnv_focal_alt_multigroup_cooccurrence_validation/scripts/analyze_all_ssnv_focal_alt_multigroup.pinned_390228ce.py",
      "source_sha256": "390228ce1fb98b59409f2517341334ab94329ef6c73a4838555fca85878027b2",
      "target": "src/m1/science.cpp",
      "target_kind": "FILE",
      "target_presence": "PRESENT",
      "target_digest_kind": "FILE_SHA256",
      "target_sha256": "61fd92db7147bf90a8e442ac9f719fbcee78ab846443e39e71554e19dbc92334",
      "implementation_status": "IMPLEMENTED",
      "verification_status": "NOT_VERIFIED",
      "verified_evidence_id": null,
      "transformation": "independent_cpp_reimplementation_against_frozen_vectors",
      "reuse": "contract_hash_and_golden_outputs_only"
    },
    {
      "origin_id": "m1-cluster-library",
      "source_path": "InterSubMod/research/20260715_single_fp_alt_multicluster_subclone_validation/scripts/focal_alt_cluster_lib.py",
      "source_sha256": "ed5f3c99461248248b20a9f49597ab5de7340a1e2055d77a1d83dbcc2799b72a",
      "target": "src/m1/science.cpp",
      "target_kind": "FILE",
      "target_presence": "PRESENT",
      "target_digest_kind": "FILE_SHA256",
      "target_sha256": "61fd92db7147bf90a8e442ac9f719fbcee78ab846443e39e71554e19dbc92334",
      "implementation_status": "IMPLEMENTED",
      "verification_status": "NOT_VERIFIED",
      "verified_evidence_id": null,
      "transformation": "independent_cpp_reimplementation_of_rng_distance_linkage_and_gates",
      "reuse": "contract_hash_and_golden_vectors_only"
    },
    {
      "origin_id": "latest-tag-join",
      "source_path": "InterSubMod/research/20260715_all_ssnv_focal_alt_multigroup_cooccurrence_validation/scripts/latest_tag_join.py",
      "source_sha256": "7ddadb05481bb61f2dc3a489762944ec347ab9f5265c69fb17538efd44b543cd",
      "target": "src/io/sidecar.cpp",
      "target_kind": "FILE",
      "target_presence": "PRESENT",
      "target_digest_kind": "FILE_SHA256",
      "target_sha256": "4b6ab00d3566f2f79016f59e655ba8da7df0075c232d7ad7997c61f1a092d1a1",
      "implementation_status": "IMPLEMENTED",
      "verification_status": "CONTRACT_VERIFIED",
      "verified_evidence_id": "IO_LATEST_TAG_JOIN",
      "transformation": "independent_cpp_reimplementation_with_stronger_full_identity_checks",
      "reuse": "contract_and_synthetic_vectors_only"
    },
    {
      "origin_id": "m2-screen-gate",
      "source_path": "InterSubMod/research/20260715_all_ssnv_focal_alt_multigroup_cooccurrence_validation/scripts/m2_screen_gate.py",
      "source_sha256": "f3d932388bf8ddc90f8fa1a136f6203dfe8d9f5aa9979ae32e9d936c2a413b79",
      "target": "src/m2/eligibility.cpp",
      "target_kind": "FILE",
      "target_presence": "PRESENT",
      "target_digest_kind": "FILE_SHA256",
      "target_sha256": "60b3aceaaa3b7bb864c2f746d0e7e126fcf6b2bac65b2116078faf0ee19f2deb",
      "implementation_status": "IMPLEMENTED",
      "verification_status": "NOT_VERIFIED",
      "verified_evidence_id": null,
      "transformation": "independent_cpp_reimplementation_against_frozen_census_and_boundaries",
      "reuse": "contract_hash_and_golden_outputs_only"
    },
    {
      "origin_id": "cooccurrence-analyzer",
      "source_path": "InterSubMod/research/20260715_all_ssnv_focal_alt_multigroup_cooccurrence_validation/scripts/analyze_methyl_ssnv_cooccurrence.py",
      "source_sha256": "3d7650983fce68abc122748d167e56b9a53bc6ef9775b9b1beb19793e25a769c",
      "target": "src/cooccurrence/site_cooccurrence.cpp",
      "target_kind": "FILE",
      "target_presence": "PRESENT",
      "target_digest_kind": "FILE_SHA256",
      "target_sha256": "9ca2daa3f01da57b1d1bd19d43a8a8b4601a0166441eabf9f51a45b783d812bf",
      "implementation_status": "IMPLEMENTED",
      "verification_status": "NOT_VERIFIED",
      "verified_evidence_id": null,
      "transformation": "review_only_until_cpp_dual_authority_is_established",
      "reuse": "unreleased_contract_reference_no_execution"
    },
    {
      "origin_id": "cooccurrence-library",
      "source_path": "InterSubMod/scripts/ssnv_cooccurrence_lib.py",
      "source_sha256": "3d41023b03f1f047312011f8513b685bf7ffe25f5d0795d253bc9013b9ec88ff",
      "target": "src/cooccurrence/statistics.cpp",
      "target_kind": "FILE",
      "target_presence": "PRESENT",
      "target_digest_kind": "FILE_SHA256",
      "target_sha256": "4f66b63903bffca85516ae930612fcc8a0d4b99939d09836c5f91ceae6bd668c",
      "implementation_status": "IMPLEMENTED",
      "verification_status": "NOT_VERIFIED",
      "verified_evidence_id": null,
      "transformation": "independent_cpp_exact_test_and_four_state_reimplementation",
      "reuse": "contract_hash_and_synthetic_vectors_only"
    },
    {
      "origin_id": "hypercube-exact",
      "source_path": "InterSubMod/research/20260716_read_linked_hypercube_exact_likelihood_validation/scripts/hypercube_exact.py",
      "source_sha256": "1def0de1952d127d8d013820ac7b0eabe33d6f1a66fd8c6d47a1985b14a32f77",
      "target": "src/solver/small_q_oracle.cpp",
      "target_kind": "FILE",
      "target_presence": "PRESENT",
      "target_digest_kind": "FILE_SHA256",
      "target_sha256": "6142fbabfb84c27dca7ffbee0c9a0d967f934bee7df7fee2765293eb7272e8f0",
      "implementation_status": "SKELETON",
      "verification_status": "NOT_VERIFIED",
      "verified_evidence_id": null,
      "transformation": "independent_cpp_reimplementation_against_frozen_small_q_oracles",
      "reuse": "contract_hash_and_frozen_outputs_only"
    },
    {
      "origin_id": "topology-ranker",
      "source_path": "InterSubMod/research/20260716_read_linked_hypercube_exact_likelihood_validation/scripts/build_m2_patterns_and_rank.py",
      "source_sha256": "b28d494563bea70cbfea7b13853d99c0b3aeafed7ed4f0c0a6fff3b92c84f0a9",
      "target": "src/solver/vertex_set_ranker.cpp",
      "target_kind": "FILE",
      "target_presence": "PRESENT",
      "target_digest_kind": "FILE_SHA256",